,dataset,funder_value,frequency
563,osf,Global Fund,8
564,osf,Annie E. Casey Foundation,8
565,osf,NATIONAL CENTER FOR RESEARCH RESOURCESUnited States Department of Health & Human ServicesNational Institutes of Health (NIH) - USANIH National Center for Research Resources (NCRR)  Funding Source: NIH RePORTER,8
566,osf,McKnight Foundation,8
567,osf,Stanford Graduate FellowshipStanford University,8
568,osf,Atlantic Philanthropies,7
569,osf,National Institute of Mental HealthUnited States Department of Health & Human ServicesNational Institutes of Health (NIH) - USANIH National Institute of Mental Health (NIMH),7
570,osf,Open Society Foundation (OSF),7
571,osf,National Science Foundation (NSF)National Science Foundation (NSF),7
572,osf,Bristol-Myers SquibbBristol-Myers Squibb,7
573,osf,U.S. National Science FoundationNational Science Foundation (NSF),7
574,osf,UNAIDS,7
575,osf,Engelberg Foundation,7
576,osf,Mekelle University,7
577,osf,NATIONAL INSTITUTE OF BIOMEDICAL IMAGING AND BIOENGINEERINGUnited States Department of Health & Human ServicesNational Institutes of Health (NIH) - USANIH National Institute of Biomedical Imaging & Bioengineering (NIBIB)  Funding Source: NIH RePORTER,7
578,osf,HHMIHoward Hughes Medical Institute,7
579,osf,Engineering and Physical Sciences Research CouncilUK Research & Innovation (UKRI)Engineering & Physical Sciences Research Council (EPSRC)  Funding Source: researchfish,7
580,osf,J. Yang & Family Foundation,7
581,osf,Howard Hughes Medical Institute Medical Research Fellows ProgramHoward Hughes Medical Institute,7
582,osf,American Cancer SocietyAmerican Cancer Society,6
583,osf,American Heart AssociationAmerican Heart Association,6
584,osf,NICHDUnited States Department of Health & Human ServicesNational Institutes of Health (NIH) - USANIH Eunice Kennedy Shriver National Institute of Child Health & Human Development (NICHD),6
585,osf,"National Heart, Lung, and Blood InstituteUnited States Department of Health & Human ServicesNational Institutes of Health (NIH) - USANIH National Heart Lung & Blood Institute (NHLBI)",6
586,osf,National Defense Science and Engineering Graduate Fellowship,6
587,osf,Russian Foundation for Basic ResearchRussian Foundation for Basic Research (RFBR),6
588,osf,Foundation Open Society Institute,6
589,osf,Open Society Initiative for Southern Africa,6
590,osf,Harry Frank Guggenheim Foundation,6
591,osf,NIH Center on Minority Health and Health DisparitiesUnited States Department of Health & Human ServicesNational Institutes of Health (NIH) - USANIH National Institute on Minority Health & Health Disparities (NIMHD),6
592,osf,NATIONAL INSTITUTE ON ALCOHOL ABUSE AND ALCOHOLISMUnited States Department of Health & Human ServicesNational Institutes of Health (NIH) - USANIH National Institute on Alcohol Abuse & Alcoholism (NIAAA)  Funding Source: NIH RePORTER,6
593,osf,European UnionEuropean Commission,6
594,osf,Open Society Institute (OSI),6
595,osf,United Nations Population Fund,6
596,osf,"Grants-in-Aid for Scientific ResearchMinistry of Education, Culture, Sports, Science and Technology, Japan (MEXT)Japan Society for the Promotion of ScienceGrants-in-Aid for Scientific Research (KAKENHI)  Funding Source: KAKEN",6
597,osf,National Institute for Health ResearchNational Institute for Health Research (NIHR)  Funding Source: researchfish,6
598,osf,NATIONAL INSTITUTE OF ARTHRITIS AND MUSCULOSKELETAL AND SKIN DISEASESUnited States Department of Health & Human ServicesNational Institutes of Health (NIH) - USANIH National Institute of Arthritis & Musculoskeletal & Skin Diseases (NIAMS)  Funding Source: NIH RePORTER,6
599,osf,Christopher and Dana Reeve Paralysis Foundation,6
600,osf,Soros Fellowship,6
601,osf,Medical Scientist Training ProgramUnited States Department of Health & Human ServicesNational Institutes of Health (NIH) - USA,6
602,osf,DOEUnited States Department of Energy (DOE),5
603,osf,Kosovo Foundation for Open Society (KFOS),5
604,osf,National Institute of Justice,5
605,osf,Canadian Institutes of Health ResearchCanadian Institutes of Health Research (CIHR),5
606,osf,MAC AIDS Fund,5
607,osf,International Development Research Centre,5
608,osf,US National Institutes of HealthUnited States Department of Health & Human ServicesNational Institutes of Health (NIH) - USA,5
609,osf,Open Society Initiative for Southern Africa (OSISA),5
610,osf,NIH Office of Rare DiseasesUnited States Department of Health & Human ServicesNational Institutes of Health (NIH) - USA,5
611,osf,Department of Labor,5
612,osf,Department of Housing and Urban Development,5
613,osf,Australian National Drug and Alcohol Research Centre,5
614,osf,Abell Foundation,5
615,osf,Swedish Research CouncilSwedish Research CouncilEuropean Commission,5
616,osf,Harvard-MIT Center for Regulatory Science,5
617,osf,Social Science Research Council,5
618,osf,California Institute for Regenerative MedicineCalifornia Institute for Regenerative Medicine,5
619,osf,Searle Scholars Foundation,5
620,osf,NINDSUnited States Department of Health & Human ServicesNational Institutes of Health (NIH) - USANIH National Institute of Neurological Disorders & Stroke (NINDS),5
621,osf,NIH/National Center for Advancing Translational Science (NCATS) UCLA CTSI GrantUnited States Department of Health & Human ServicesNational Institutes of Health (NIH) - USANIH National Center for Advancing Translational Sciences (NCATS),5
622,osf,Rockefeller Foundation,5
623,osf,"Johns Hopkins University Center for AIDS Research, a National Institute of Health (NIH)",5
624,osf,Open Society Foundations International Palliative Care Initiative,5
625,osf,NIH through NIMHUnited States Department of Health & Human ServicesNational Institutes of Health (NIH) - USANIH National Institute of Mental Health (NIMH),5
626,osf,Bill & Melinda Gates FoundationBill & Melinda Gates Foundation,5
627,osf,NIH Director's Pioneer AwardUnited States Department of Health & Human ServicesNational Institutes of Health (NIH) - USA,5
628,osf,NIH Medical Scientist Training ProgramUnited States Department of Health & Human ServicesNational Institutes of Health (NIH) - USA,5
629,osf,Florida International University,4
630,osf,Open Society Initiative for Eastern Africa (OSIEA),4
631,osf,Leukemia & Lymphoma SocietyLeukemia and Lymphoma Society,4
632,osf,Robertson Foundation,4
633,osf,P.D. Soros Fellowship for New Americans,4
634,osf,Cottrell Scholar Program through the Research Corporation for Science Advancement,4
635,osf,"JSPS KAKENHIMinistry of Education, Culture, Sports, Science and Technology, Japan (MEXT)Japan Society for the Promotion of ScienceGrants-in-Aid for Scientific Research (KAKENHI)",4
636,osf,Harvard Medical Scientist Training Program,4
637,osf,Yale MSTP NIH,4
638,osf,ARNEC,4
639,osf,Oak Foundation,4
640,osf,National Science Foundation Graduate Research FellowshipNational Science Foundation (NSF),4
641,osf,Howard Hughes Medical Institute (HHMI)Howard Hughes Medical Institute,4
642,osf,United Nations Development Programme,4
643,osf,NIMHUnited States Department of Health & Human ServicesNational Institutes of Health (NIH) - USANIH National Institute of Mental Health (NIMH),4
644,osf,NIAIDUnited States Department of Health & Human ServicesNational Institutes of Health (NIH) - USANIH National Institute of Allergy & Infectious Diseases (NIAID),4
645,osf,Australian National Health and Medical Research CouncilNational Health and Medical Research Council of Australia,4
646,osf,Wellcome TrustWellcome TrustEuropean Commission,4
647,osf,National Institute on Drug Abuse (NIDA)United States Department of Health & Human ServicesNational Institutes of Health (NIH) - USANIH National Institute on Drug Abuse (NIDA),4
648,osf,Google Research Award,4
649,osf,Defense Advanced Research Projects AgencyUnited States Department of DefenseDefense Advanced Research Projects Agency (DARPA),4
650,osf,Gilead SciencesGilead Sciences,4
651,osf,Virginia and D. K. Ludwig Fund for Cancer Research,4
652,osf,California Institute of Regenerative MedicineCalifornia Institute for Regenerative Medicine,4
653,osf,Russell Sage Foundation,4
654,osf,"Bureau of Justice Assistance, Office of Justice Programs, U.S. Department of Justice",4
655,osf,Columbia University,4
656,osf,National Research Foundation,4
657,osf,NATIONAL LIBRARY OF MEDICINEUnited States Department of Health & Human ServicesNational Institutes of Health (NIH) - USANIH National Library of Medicine (NLM)  Funding Source: NIH RePORTER,4
658,osf,Siebel Stem Cell Institute,4
659,osf,German Research FoundationGerman Research Foundation (DFG),4
660,osf,New York Community Trust,4
661,osf,NIGMSUnited States Department of Health & Human ServicesNational Institutes of Health (NIH) - USANIH National Institute of General Medical Sciences (NIGMS),4
662,osf,Welch FoundationThe Welch Foundation,4
663,osf,Fogarty International CenterUnited States Department of Health & Human ServicesNational Institutes of Health (NIH) - USANIH Fogarty International Center (FIC),4
664,osf,Elton John Foundation,4
665,osf,South African Medical Research CouncilUK Research & Innovation (UKRI)Medical Research Council UK (MRC),4
666,osf,NSF-GFRP,4
667,osf,Reorganization and Plasticity to Accelerate Injury Recovery,4
668,osf,Friends of the McGovern Institute Fellowship,4
669,osf,"Centers for Disease Control and Prevention (National Center for Injury Prevention and Control and National Center for HIV/AIDS, Viral Hepatitis, STD, and TB Prevention)",4
670,osf,International AIDS Society,4
671,osf,Burroughs Wellcome FundBurroughs Wellcome Fund,4
672,osf,Keck FoundationW.M. Keck Foundation,4
673,osf,Damon Runyon Foundation,4
674,osf,NATIONAL INSTITUTE ON DEAFNESS AND OTHER COMMUNICATION DISORDERSUnited States Department of Health & Human ServicesNational Institutes of Health (NIH) - USANIH National Institute on Deafness & Other Communication Disorders (NIDCD)  Funding Source: NIH RePORTER,4
675,osf,International Atomic Energy Agency Programme of Action for Cancer Therapy,4
676,osf,Sheikh Mohammed Hussein Al-Amoudi Center of Excellence in Breast Cancer,4
677,osf,Pan American Health Organization,4
678,osf,European Society of Medical Oncology,4
679,osf,European School of Oncology,4
680,osf,LIVE-STRONG,4
681,osf,Eli LillyEli Lilly,4
682,osf,Alfred P. Sloan FoundationAlfred P. Sloan Foundation,3
683,osf,Air Force Office of Scientific ResearchUnited States Department of DefenseAir Force Office of Scientific Research (AFOSR),3
684,osf,Centers for Disease Control and Prevention (National Center for Injury Prevention and Control)United States Department of Health & Human ServicesCenters for Disease Control & Prevention - USA,3
685,osf,Substance Abuse and Mental Health Services AdministrationUnited States Department of Health & Human Services,3
686,osf,National Institute on Minority Health and Health DisparitiesUnited States Department of Health & Human ServicesNational Institutes of Health (NIH) - USANIH National Institute on Minority Health & Health Disparities (NIMHD),3
687,osf,Krechevsky Foundation,3
688,osf,American Heart Association Predoctoral FellowshipAmerican Heart Association,3
689,osf,NSF CAREER grantNational Science Foundation (NSF)NSF - Office of the Director (OD),3
690,osf,Doris Duke Charitable FoundationDoris Duke Charitable Foundation (DDCF),3
691,osf,National Institute of Child Health and Human DevelopmentUnited States Department of Health & Human ServicesNational Institutes of Health (NIH) - USANIH Eunice Kennedy Shriver National Institute of Child Health & Human Development (NICHD),3
692,osf,Koc UniversityKoc University,3
693,osf,British Academy/Leverhulme Small Research Grant,3
694,osf,Open Society Foundation's Human Rights Initiative,3
695,osf,ARCAustralian Research Council,3
696,osf,Yale Predoctoral Program in Cellular and Molecular Biology,3
697,osf,Department of EnergyUnited States Department of Energy (DOE),3
698,osf,Robert Carr Fund,3
699,osf,Open Society Foundation for South Africa,3
700,osf,Social Sciences and Humanities Research Council of CanadaSocial Sciences and Humanities Research Council of Canada (SSHRC),3
701,osf,Heritage Medical Research Institute,3
702,osf,Global Change and Sustainability Research Institute (GCSRI),3
703,osf,National Science Foundation Graduate FellowshipNational Science Foundation (NSF),3
704,osf,Sigrid Rausing Trust,3
705,osf,Soros grant,3
706,osf,National Institute for Drug AbuseUnited States Department of Health & Human ServicesNational Institutes of Health (NIH) - USANIH National Institute on Drug Abuse (NIDA),3
707,osf,NSF Graduate Research Fellowship ProgramNational Science Foundation (NSF),3
708,osf,WHOWorld Health Organization,3
709,osf,Hertz Foundation,3
710,osf,ViiV Healthcare,3
711,osf,Open Society Foundation South Africa,3
712,osf,UCLA-Caltech Medical Scientist Training Program,3
713,osf,Open Society Foundation - South Africa,3
714,osf,Engineering and Physical Sciences Research CouncilUK Research & Innovation (UKRI)Engineering & Physical Sciences Research Council (EPSRC),3
715,osf,National Institute for Health Research (NIHR)National Institute for Health Research (NIHR),3
716,osf,Poitras Center for Affective Disorders Research at MIT,3
717,osf,Hock E. Tan and K. Lisa Yang Center for Autism Research at MIT,3
718,osf,Laura and John Arnold Foundation,3
719,osf,RiverStyx Foundation,3
720,osf,Vital Projects Fund,3
721,osf,Massena Foundation,3
722,osf,City of Seattle,3
723,osf,Brot fur die Welt,3
724,osf,Wenner-Gren Foundation,3
725,osf,NATIONAL EYE INSTITUTEUnited States Department of Health & Human ServicesNational Institutes of Health (NIH) - USANIH National Eye Institute (NEI)  Funding Source: NIH RePORTER,3
726,osf,PD Soros Fellowship,3
727,osf,Thomas and Stacey Siebel Foundation,3
728,osf,Human Frontier Science Program Career Development Award,3
729,osf,NIDAUnited States Department of Health & Human ServicesNational Institutes of Health (NIH) - USANIH National Institute on Drug Abuse (NIDA),3
730,osf,NIBIBUnited States Department of Health & Human ServicesNational Institutes of Health (NIH) - USANIH National Institute of Biomedical Imaging & Bioengineering (NIBIB),3
731,osf,Starr Foundation,3
732,osf,Robin Hood Foundation,3
733,osf,Tiger Foundation,3
734,osf,Bloomberg Philanthropies,3
735,osf,NCIUnited States Department of Health & Human ServicesNational Institutes of Health (NIH) - USANIH National Cancer Institute (NCI),3
736,osf,NIDDKUnited States Department of Health & Human ServicesNational Institutes of Health (NIH) - USANIH National Institute of Diabetes & Digestive & Kidney Diseases (NIDDK),3
737,osf,Sloan FoundationAlfred P. Sloan Foundation,3
738,osf,Elton John AIDS Foundation,3
739,osf,United States Cancer Pain Relief Committee,3
740,osf,President's Early Career Award in Science and Engineering,3
741,osf,National Research Service AwardUnited States Department of Health & Human ServicesNational Institutes of Health (NIH) - USA,3
742,osf,Glenn Foundation for Medical Research,3
743,osf,Open Society Foundations Criminal Justice Fund,3
744,osf,Michael Smith Foundation for Health ResearchMichael Smith Foundation for Health Research,3
745,osf,Livestrong Foundation,3
746,osf,Open Society Foundation's International Palliative Care Initiative,3
747,osf,Eunice Kennedy Shriver National Institute of Child Health and Human DevelopmentUnited States Department of Health & Human ServicesNational Institutes of Health (NIH) - USANIH Eunice Kennedy Shriver National Institute of Child Health & Human Development (NICHD),3
748,osf,LIVESTRONG Foundation,3
749,osf,Boehringer IngelheimBoehringer Ingelheim,3
750,mellon,Andrew W. Mellon Foundation,1125
751,mellon,Mellon Foundation,536
752,mellon,National Science FoundationNational Science Foundation (NSF),485
753,mellon,Andrew Mellon Foundation,366
754,mellon,NSFNational Science Foundation (NSF),198
755,mellon,John D. and Catherine T. MacArthur Foundation,160
756,mellon,Smithsonian Tropical Research InstituteSmithsonian InstitutionSmithsonian Tropical Research Institute,126
757,mellon,Center for Tropical Forest ScienceSmithsonian InstitutionSmithsonian Tropical Research Institute,95
758,mellon,Gordon and Betty Moore FoundationGordon and Betty Moore Foundation,93
759,mellon,National Research Foundation,84
760,mellon,David and Lucile Packard FoundationThe David & Lucile Packard Foundation,78
761,mellon,U.S. National Science FoundationNational Science Foundation (NSF),75
762,mellon,Direct For Biological SciencesNational Science Foundation (NSF)NSF - Directorate for Biological Sciences (BIO)  Funding Source: National Science Foundation,75
763,mellon,Division Of Environmental BiologyNational Science Foundation (NSF)NSF - Directorate for Biological Sciences (BIO)  Funding Source: National Science Foundation,73
764,mellon,Avatar Alliance Foundation,60
765,mellon,A.W. Mellon Foundation,58
766,mellon,University of the Witwatersrand,57
767,mellon,Grantham Foundation for the Protection of the Environment,54
768,mellon,National Research Foundation of South AfricaNational Research Foundation - South Africa,52
769,mellon,Margaret A. Cargill Foundation,52
770,mellon,US National Science FoundationNational Science Foundation (NSF),52
771,mellon,Small World Institute Fund,51
772,mellon,Celera Foundation,51
773,mellon,National Geographic SocietyNational Geographic Society,51
774,mellon,W. M. Keck FoundationW.M. Keck Foundation,46
775,mellon,Andrew W Mellon Foundation,45
776,mellon,A. W. Mellon Foundation,44
777,mellon,South African National Research FoundationNational Research Foundation - South Africa,39
778,mellon,EUNICE KENNEDY SHRIVER NATIONAL INSTITUTE OF CHILD HEALTH & HUMAN DEVELOPMENTUnited States Department of Health & Human ServicesNational Institutes of Health (NIH) - USANIH Eunice Kennedy Shriver National Institute of Child Health & Human Development (NICHD)  Funding Source: NIH RePORTER,37
779,mellon,National Science Foundation (NSF)National Science Foundation (NSF),36
780,mellon,American Council of Learned Societies,36
781,mellon,Natural Environment Research CouncilUK Research & Innovation (UKRI)Natural Environment Research Council (NERC)  Funding Source: researchfish,35
782,mellon,National Research Foundation (NRF),34
783,mellon,Wenner-Gren Foundation,33
784,mellon,University of Cape Town,33
785,mellon,Social Science Research Council,32
786,mellon,"Wellcome Trust, UKWellcome Trust",27
787,mellon,NATIONAL INSTITUTE ON AGINGUnited States Department of Health & Human ServicesNational Institutes of Health (NIH) - USANIH National Institute on Aging (NIA)  Funding Source: NIH RePORTER,26
788,mellon,National Institutes of HealthUnited States Department of Health & Human ServicesNational Institutes of Health (NIH) - USA,25
789,mellon,NATIONAL INSTITUTE OF ALLERGY AND INFECTIOUS DISEASESUnited States Department of Health & Human ServicesNational Institutes of Health (NIH) - USANIH National Institute of Allergy & Infectious Diseases (NIAID)  Funding Source: NIH RePORTER,24
790,mellon,NIHUnited States Department of Health & Human ServicesNational Institutes of Health (NIH) - USA,24
791,mellon,Sigma Xi,23
792,mellon,National Institute on AgingUnited States Department of Health & Human ServicesNational Institutes of Health (NIH) - USANIH National Institute on Aging (NIA),23
793,mellon,Ford Foundation,23
794,mellon,NRF,23
795,mellon,Smithsonian InstitutionSmithsonian Institution,22
796,mellon,Andrew W. Mellon foundation,22
797,mellon,Directorate For GeosciencesNational Science Foundation (NSF)NSF - Directorate for Geosciences (GEO)  Funding Source: National Science Foundation,22
798,mellon,NASANational Aeronautics & Space Administration (NASA),22
799,mellon,William and Flora Hewlett Foundation,21
800,mellon,AW Mellon Foundation,20
801,mellon,European UnionEuropean Commission,20
802,mellon,Andrew W. Mellon Foundation Endowed Fund for Innovative Research,20
803,mellon,MacArthur Foundation,20
804,mellon,National Endowment for the Humanities,19
805,mellon,Samuel H. Kress Foundation,19
806,mellon,Wellcome TrustWellcome TrustEuropean Commission,19
807,mellon,Social Sciences and Humanities Research Council of CanadaSocial Sciences and Humanities Research Council of Canada (SSHRC),18
808,mellon,Rhodes University,17
809,mellon,NATIONAL INSTITUTE ON DRUG ABUSEUnited States Department of Health & Human ServicesNational Institutes of Health (NIH) - USANIH National Institute on Drug Abuse (NIDA)European Commission  Funding Source: NIH RePORTER,17
810,mellon,National Natural Science Foundation of ChinaNational Natural Science Foundation of China (NSFC),17
811,mellon,University of CaliforniaUniversity of California System,16
812,mellon,W.M. Keck FoundationW.M. Keck Foundation,16
813,mellon,South African Department of Science and Technology,16
814,mellon,Emory Center for AIDS Research,15
815,mellon,NATIONAL INSTITUTE OF MENTAL HEALTHUnited States Department of Health & Human ServicesNational Institutes of Health (NIH) - USANIH National Institute of Mental Health (NIMH)  Funding Source: NIH RePORTER,15
816,mellon,South African Research Chairs Initiative of the Department of Science and Technology,15
817,mellon,Natural Sciences and Engineering Research Council of CanadaNatural Sciences and Engineering Research Council of Canada (NSERC)CGIAR,15
818,mellon,Australian Research CouncilAustralian Research Council,15
819,mellon,Carnegie Institution for Science,14
820,mellon,South African Medical Research CouncilUK Research & Innovation (UKRI)Medical Research Council UK (MRC),14
821,mellon,Howard Hughes Medical InstituteHoward Hughes Medical Institute,14
822,mellon,,13
823,mellon,University of Puerto Rico,13
824,mellon,Wayne and Gladys Valley Foundation,13
825,mellon,Social Science Research Council's International Dissertation Research Fellowship,12
826,mellon,STRISmithsonian InstitutionSmithsonian Tropical Research Institute,12
827,mellon,CTFS,12
828,mellon,University of Connecticut Research Foundation,12
829,mellon,DST-NRF Centre of Excellence for Invasion BiologyDepartment of Science & Technology (India),12
830,mellon,Grainger Foundation,12
831,mellon,Palaeontological Scientific Trust,12
832,mellon,South African National Parks,11
833,mellon,Oppenheimer Memorial Trust,11
834,mellon,American Philosophical Society,11
835,mellon,Keck FoundationW.M. Keck Foundation,11
836,mellon,Tinker Foundation,11
837,mellon,Andrew Mellon foundation,11
838,mellon,Division Of Earth SciencesNational Science Foundation (NSF)NSF - Directorate for Geosciences (GEO)  Funding Source: National Science Foundation,11
839,mellon,U.S. Forest ServiceUnited States Department of Agriculture (USDA)United States Forest Service,11
840,mellon,Oppenheimer and Ackerman families,11
841,mellon,EUNICE KENNEDY SHRIVER NATIONAL INSTITUTE OF CHILD HEALTH &HUMAN DEVELOPMENTUnited States Department of Health & Human ServicesNational Institutes of Health (NIH) - USANIH Eunice Kennedy Shriver National Institute of Child Health & Human Development (NICHD)  Funding Source: NIH RePORTER,11
842,mellon,Spencer Foundation,10
843,mellon,World Wildlife Fund,10
844,mellon,Rainforest Trust,10
845,mellon,Rockefeller Foundation,10
846,mellon,HSBC Climate Partnership,10
847,mellon,National Science Foundation Graduate Research FellowshipNational Science Foundation (NSF),9
848,mellon,US National Institute for Child Health and Human DevelopmentUnited States Department of Health & Human ServicesNational Institutes of Health (NIH) - USANIH Eunice Kennedy Shriver National Institute of Child Health & Human Development (NICHD),9
849,mellon,South African National Research Foundation (NRF)National Research Foundation - South Africa,9
850,mellon,NSF Graduate Research FellowshipNational Science Foundation (NSF),9
851,mellon,NSERCNatural Sciences and Engineering Research Council of Canada (NSERC),9
852,mellon,Division Of Ocean SciencesNational Science Foundation (NSF)NSF - Directorate for Geosciences (GEO)  Funding Source: National Science Foundation,9
853,mellon,Hewlett Foundation,9
854,mellon,U.S. Diplomatic Mission to South Africa,9
855,mellon,Nature Conservancy,8
856,mellon,US National Science Foundation (NSF)National Science Foundation (NSF),8
857,mellon,Swiss National Science FoundationSwiss National Science Foundation (SNSF)European Commission,8
858,mellon,Fulbright Commission,8
859,mellon,Roundtable on Sustainable Palm Oil,8
860,mellon,"Grants-in-Aid for Scientific ResearchMinistry of Education, Culture, Sports, Science and Technology, Japan (MEXT)Japan Society for the Promotion of ScienceGrants-in-Aid for Scientific Research (KAKENHI)  Funding Source: KAKEN",8
861,mellon,NATIONAL CENTER FOR ADVANCING TRANSLATIONAL SCIENCESUnited States Department of Health & Human ServicesNational Institutes of Health (NIH) - USANIH National Center for Advancing Translational Sciences (NCATS)  Funding Source: NIH RePORTER,8
862,mellon,Claude Leon Foundation,8
863,mellon,Duke University,8
864,mellon,William Hearst III,8
865,mellon,Cornell University,8
866,mellon,ONROffice of Naval Research,8
867,mellon,NATIONAL CENTER FOR RESEARCH RESOURCESUnited States Department of Health & Human ServicesNational Institutes of Health (NIH) - USANIH National Center for Research Resources (NCRR)  Funding Source: NIH RePORTER,8
868,mellon,NOAANational Oceanic Atmospheric Admin (NOAA) - USA,8
869,mellon,National Research Foundation (NRF) of South AfricaNational Research Foundation - South Africa,8
870,mellon,French Embassy of South Africa,8
871,mellon,Texas AM University,8
872,mellon,Swedish Research CouncilSwedish Research CouncilEuropean Commission,8
873,mellon,Stellenbosch University,7
874,mellon,CONACYTConsejo Nacional de Ciencia y Tecnologia (CONACyT),7
875,mellon,Missouri Botanical Garden,7
876,mellon,Villum Fonden  Funding Source: researchfish,7
877,mellon,University of Aarhus of Denmark,7
878,mellon,International Institute for Nanotechnology (IIN),7
879,mellon,FONDECYTComision Nacional de Investigacion Cientifica y Tecnologica (CONICYT)CONICYT FONDECYT,7
880,mellon,Fulbright Foundation,7
