,dataset,funder_value,frequency
881,mellon,National Institute on Aging (NIA) of the NIH,7
882,mellon,University of MinnesotaUniversity of Minnesota System,7
883,mellon,National Research Foundation (South Africa)National Research Foundation - South Africa,7
884,mellon,"Anglo-American Chairman's Fund, South Africa",7
885,mellon,McHugh Otolaryngology Research Fund,7
886,mellon,Mellon Foundation Social Sciences Dissertation-Year Fellowship,7
887,mellon,USDAUnited States Department of Agriculture (USDA),7
888,mellon,David and Lucille Packard FoundationThe David & Lucile Packard Foundation,7
889,mellon,FondecytComision Nacional de Investigacion Cientifica y Tecnologica (CONICYT)CONICYT FONDECYT,7
890,mellon,Carnegie Foundation,7
891,mellon,ERCEuropean Research Council (ERC)European Commission,7
892,mellon,Arnold Arboretum of Harvard University,7
893,mellon,State of California,7
894,mellon,Medical Research CouncilUK Research & Innovation (UKRI)Medical Research Council UK (MRC)European Commission  Funding Source: researchfish,7
895,mellon,"New Zealand Foundation for Research, Science and TechnologyNew Zealand Foundation for Research, Science and Technology",7
896,mellon,National Parks Ecological Research Fellowship Program,7
897,mellon,"Andrew W. Mellon Foundation, USA",7
898,mellon,National Center for Ecological Analysis and Synthesis,7
899,mellon,National Park Foundation,7
900,mellon,Wesleyan University,6
901,mellon,Russell Sage Foundation,6
902,mellon,NASA Terrestrial Ecology ProgramNational Aeronautics & Space Administration (NASA),6
903,mellon,UN Development Programme,6
904,mellon,government of Ecuador,6
905,mellon,Department of Science and Technology (DST)Department of Science & Technology (India),6
906,mellon,Fulbright Program,6
907,mellon,"State of Illinois, through the IIN",6
908,mellon,Partner University Fund,6
909,mellon,Mellon Foundation/American Council of Learned Societies,6
910,mellon,"National Research Foundation, South AfricaNational Research Foundation - South Africa",6
911,mellon,University of ChicagoUniversity of Chicago,6
912,mellon,USDA Forest ServiceUnited States Department of Agriculture (USDA)United States Forest Service,6
913,mellon,Inter-American Foundation,6
914,mellon,Morgan Family Foundation,6
915,mellon,CNPqConselho Nacional de Desenvolvimento Cientifico e Tecnologico (CNPQ),6
916,mellon,Blue Moon Fund,6
917,mellon,Wenner-Gren Foundation for Anthropological Research,6
918,mellon,"Utah Agricultural Experiment Station, Utah State University",6
919,mellon,RK Mellon Foundation,6
920,mellon,National Institute on Drug AbuseUnited States Department of Health & Human ServicesNational Institutes of Health (NIH) - USANIH National Institute on Drug Abuse (NIDA)European Commission,6
921,mellon,University of MichiganUniversity of Michigan System,6
922,mellon,Medical Research CouncilUK Research & Innovation (UKRI)Medical Research Council UK (MRC)European Commission,6
923,mellon,Stockman Family Foundation,6
924,mellon,University of Pretoria,6
925,mellon,Volkswagen FoundationVolkswagen,6
926,mellon,A. H. Schultz Foundation,6
927,mellon,Northwestern University,6
928,mellon,Robert Wood Johnson FoundationRobert Wood Johnson Foundation (RWJF),6
929,mellon,US National Institutes of HealthUnited States Department of Health & Human ServicesNational Institutes of Health (NIH) - USA,6
930,mellon,Geological Society of America,6
931,mellon,Brazil's Ministry for Science and Technology,6
932,mellon,Summit Foundation,6
933,mellon,AIDS Foundation of Amsterdam,6
934,mellon,U.S. National Aeronautics and Space AdministrationNational Aeronautics & Space Administration (NASA),6
935,mellon,National Park Service,6
936,mellon,U.S. Department of AgricultureUnited States Department of Agriculture (USDA),6
937,mellon,Wenner Gren Foundation,5
938,mellon,National Institute of Mental Health of the US National Institutes of HealthUnited States Department of Health & Human ServicesNational Institutes of Health (NIH) - USANIH National Institute of Mental Health (NIMH),5
939,mellon,Andrew F. Mellon Foundation,5
940,mellon,Oregon State University,5
941,mellon,Soft and Hybrid Nanotechnology Experimental (SHyNE) Resource,5
942,mellon,MRSEC program at the Materials Research Center,5
943,mellon,South African National Biodiversity Institute,5
944,mellon,NATIONAL INSTITUTE OF ENVIRONMENTAL HEALTH SCIENCESUnited States Department of Health & Human ServicesNational Institutes of Health (NIH) - USANIH National Institute of Environmental Health Sciences (NIEHS)  Funding Source: NIH RePORTER,5
945,mellon,University of Canterbury,5
946,mellon,Andrew W Mellon Foundation of New York,5
947,mellon,McCormick School of Engineering and Applied Science,5
948,mellon,Department of Materials Science and Engineering at Northwestern University,5
949,mellon,CONICETConsejo Nacional de Investigaciones Cientificas y Tecnicas (CONICET),5
950,mellon,Palaeontological Scientific Trust (PAST),5
951,mellon,Royal SocietyRoyal Society of LondonEuropean Commission,5
952,mellon,Syracuse University's Geography Department,5
953,mellon,American Institute of Indian Studies,5
954,mellon,Land Tenure Center at the University of Wisconsin-Madison,5
955,mellon,Michigan State University,5
956,mellon,National Oceanic and Atmospheric AdministrationNational Oceanic Atmospheric Admin (NOAA) - USA,5
957,mellon,Society of Systematic Biologists,5
958,mellon,Mario Einaudi Center for International Studies,5
959,mellon,Cornell Sigma Xi,5
960,mellon,European Research CouncilEuropean Research Council (ERC)European Commission,5
961,mellon,European CommissionEuropean CommissionEuropean Commission Joint Research Centre,5
962,mellon,Council on Library and Information Resources,5
963,mellon,Wellcome Trust (UK)Wellcome Trust,5
964,mellon,The Mellon Foundation,5
965,mellon,Yale Institute for Biospheric Studies,5
966,mellon,Knox College,5
967,mellon,Health Economics & HIV/AIDS Research Division (HEARD) at the University of KwaZulu-Natal,5
968,mellon,SANParks,5
969,mellon,Frank Levinson Family Foundation,5
970,mellon,Stanford UniversityStanford University,5
971,mellon,Academy of FinlandAcademy of FinlandEuropean Commission,5
972,mellon,American Association of University Women,5
973,mellon,Leakey Foundation,5
974,mellon,Department of Science and TechnologyDepartment of Science & Technology (India),5
975,mellon,Deutsche ForschungsgemeinschaftGerman Research Foundation (DFG),5
976,mellon,"University of California, Santa BarbaraUniversity of California System",5
977,mellon,Direct For Mathematical & Physical ScienNational Science Foundation (NSF)NSF - Directorate for Mathematical & Physical Sciences (MPS)  Funding Source: National Science Foundation,5
978,mellon,Deutscher Akademischer Austausch DienstDeutscher Akademischer Austausch Dienst (DAAD),5
979,mellon,Chinese Academy of SciencesChinese Academy of Sciences,5
980,mellon,Kearney Foundation of Soil Science,5
981,mellon,University of Tennessee,5
982,mellon,American Museum of Natural History,5
983,mellon,Cornell Department of Ecology and Evolutionary Biology,5
984,mellon,FOGARTY INTERNATIONAL CENTERUnited States Department of Health & Human ServicesNational Institutes of Health (NIH) - USANIH Fogarty International Center (FIC)  Funding Source: NIH RePORTER,5
985,mellon,U.S. Department of EnergyUnited States Department of Energy (DOE),5
986,mellon,"Conservation, Food and Health Foundation",5
987,mellon,World Wildlife Fund-US,5
988,mellon,Shell Oil,5
989,mellon,Citibank,5
990,mellon,Champion International,5
991,mellon,Homeland Foundation,5
992,mellon,Mazda Wildlife Fund,5
993,mellon,University of Virginia,5
994,mellon,Research Council of NorwayResearch Council of Norway,5
995,mellon,James S. McDonnell Foundation,5
996,mellon,U.S. Agency for International DevelopmentUnited States Agency for International Development (USAID),5
997,mellon,Ecological Society of America,5
998,mellon,National Institute of Mental HealthUnited States Department of Health & Human ServicesNational Institutes of Health (NIH) - USANIH National Institute of Mental Health (NIMH),5
999,mellon,Trapnell Fund,5
1000,gates,Bill and Melinda Gates FoundationBill & Melinda Gates Foundation,9873
1001,gates,Bill & Melinda Gates FoundationBill & Melinda Gates Foundation,5548
1002,gates,NATIONAL INSTITUTE OF ALLERGY AND INFECTIOUS DISEASESUnited States Department of Health & Human ServicesNational Institutes of Health (NIH) - USANIH National Institute of Allergy & Infectious Diseases (NIAID)  Funding Source: NIH RePORTER,3625
1003,gates,Bill & Melinda Gates FoundationBill & Melinda Gates FoundationCGIAR,2579
1004,gates,NIHUnited States Department of Health & Human ServicesNational Institutes of Health (NIH) - USA,1538
1005,gates,Wellcome TrustWellcome TrustEuropean Commission,1473
1006,gates,National Institutes of HealthUnited States Department of Health & Human ServicesNational Institutes of Health (NIH) - USA,1402
1007,gates,Medical Research CouncilUK Research & Innovation (UKRI)Medical Research Council UK (MRC)European Commission  Funding Source: researchfish,899
1008,gates,NATIONAL INSTITUTE OF GENERAL MEDICAL SCIENCESUnited States Department of Health & Human ServicesNational Institutes of Health (NIH) - USANIH National Institute of General Medical Sciences (NIGMS)  Funding Source: NIH RePORTER,815
1009,gates,EUNICE KENNEDY SHRIVER NATIONAL INSTITUTE OF CHILD HEALTH & HUMAN DEVELOPMENTUnited States Department of Health & Human ServicesNational Institutes of Health (NIH) - USANIH Eunice Kennedy Shriver National Institute of Child Health & Human Development (NICHD)  Funding Source: NIH RePORTER,809
1010,gates,,611
1011,gates,National Science FoundationNational Science Foundation (NSF),466
1012,gates,Gates FoundationBill & Melinda Gates Foundation,452
1013,gates,NATIONAL CANCER INSTITUTEUnited States Department of Health & Human ServicesNational Institutes of Health (NIH) - USANIH National Cancer Institute (NCI)  Funding Source: NIH RePORTER,425
1014,gates,FOGARTY INTERNATIONAL CENTERUnited States Department of Health & Human ServicesNational Institutes of Health (NIH) - USANIH Fogarty International Center (FIC)  Funding Source: NIH RePORTER,378
1015,gates,"NATIONAL HEART, LUNG, AND BLOOD INSTITUTEUnited States Department of Health & Human ServicesNational Institutes of Health (NIH) - USANIH National Heart Lung & Blood Institute (NHLBI)  Funding Source: NIH RePORTER",363
1016,gates,NATIONAL INSTITUTE OF MENTAL HEALTHUnited States Department of Health & Human ServicesNational Institutes of Health (NIH) - USANIH National Institute of Mental Health (NIMH)  Funding Source: NIH RePORTER,342
1017,gates,European UnionEuropean Commission,308
1018,gates,NATIONAL INSTITUTE OF DIABETES AND DIGESTIVE AND KIDNEY DISEASESUnited States Department of Health & Human ServicesNational Institutes of Health (NIH) - USANIH National Institute of Diabetes & Digestive & Kidney Diseases (NIDDK)  Funding Source: NIH RePORTER,308
1019,gates,National Institute of Allergy and Infectious DiseasesUnited States Department of Health & Human ServicesNational Institutes of Health (NIH) - USANIH National Institute of Allergy & Infectious Diseases (NIAID),305
1020,gates,"OFFICE OF THE DIRECTOR, NATIONAL INSTITUTES OF HEALTHUnited States Department of Health & Human ServicesNational Institutes of Health (NIH) - USA  Funding Source: NIH RePORTER",294
1021,gates,Bill and Melinda Gates Foundation (BMGF)Bill & Melinda Gates Foundation,291
1022,gates,USAIDUnited States Agency for International Development (USAID),285
1023,gates,Bill & Melinda Gates Foundation (BMGF)Bill & Melinda Gates Foundation,280
1024,gates,NATIONAL CENTER FOR ADVANCING TRANSLATIONAL SCIENCESUnited States Department of Health & Human ServicesNational Institutes of Health (NIH) - USANIH National Center for Advancing Translational Sciences (NCATS)  Funding Source: NIH RePORTER,267
1025,gates,National Natural Science Foundation of ChinaNational Natural Science Foundation of China (NSFC),265
1026,gates,NIAIDUnited States Department of Health & Human ServicesNational Institutes of Health (NIH) - USANIH National Institute of Allergy & Infectious Diseases (NIAID),263
1027,gates,NATIONAL CENTER FOR RESEARCH RESOURCESUnited States Department of Health & Human ServicesNational Institutes of Health (NIH) - USANIH National Center for Research Resources (NCRR)  Funding Source: NIH RePORTER,248
1028,gates,Medical Research CouncilUK Research & Innovation (UKRI)Medical Research Council UK (MRC)European Commission,238
1029,gates,US National Institutes of HealthUnited States Department of Health & Human ServicesNational Institutes of Health (NIH) - USA,234
1030,gates,National Institute for Health ResearchNational Institute for Health Research (NIHR)  Funding Source: researchfish,228
1031,gates,National Institutes of Health (NIH)United States Department of Health & Human ServicesNational Institutes of Health (NIH) - USA,226
1032,gates,UK Department for International Development,224
1033,gates,UK Medical Research CouncilUK Research & Innovation (UKRI)Medical Research Council UK (MRC),222
1034,gates,Howard Hughes Medical InstituteHoward Hughes Medical Institute,197
1035,gates,NSFNational Science Foundation (NSF),197
1036,gates,World BankThe World Bank India,186
1037,gates,Canadian Institutes of Health ResearchCanadian Institutes of Health Research (CIHR),177
1038,gates,"Fogarty International Center, National Institutes of HealthUnited States Department of Health & Human ServicesNational Institutes of Health (NIH) - USANIH Fogarty International Center (FIC)",176
1039,gates,United States Agency for International DevelopmentUnited States Agency for International Development (USAID),175
1040,gates,UK Department for International Development (DFID),175
1041,gates,World Health OrganizationWorld Health Organization,171
1042,gates,Bill & Melinda Gates Foundation,167
1043,gates,United States Agency for International Development (USAID)United States Agency for International Development (USAID)CGIAR,164
1044,gates,United States Agency for International Development (USAID)United States Agency for International Development (USAID),161
1045,gates,European CommissionEuropean CommissionEuropean Commission Joint Research Centre,159
1046,gates,European Research CouncilEuropean Research Council (ERC)European Commission,156
1047,gates,Eunice Kennedy Shriver National Institute of Child Health and Human DevelopmentUnited States Department of Health & Human ServicesNational Institutes of Health (NIH) - USANIH Eunice Kennedy Shriver National Institute of Child Health & Human Development (NICHD),153
1048,gates,Rockefeller Foundation,152
1049,gates,Bill & Melinda Gates FoundationCGIAR,152
1050,gates,Biotechnology and Biological Sciences Research CouncilUK Research & Innovation (UKRI)Biotechnology and Biological Sciences Research Council (BBSRC)  Funding Source: researchfish,151
1051,gates,NIH/NIAIDUnited States Department of Health & Human ServicesNational Institutes of Health (NIH) - USANIH National Institute of Allergy & Infectious Diseases (NIAID),149
1052,gates,WHOWorld Health Organization,147
1053,gates,UK Medical Research Council (MRC)UK Research & Innovation (UKRI)Medical Research Council UK (MRC),143
1054,gates,South African Medical Research CouncilUK Research & Innovation (UKRI)Medical Research Council UK (MRC),142
1055,gates,Bill & Melinda Gates Foundation  Grand Challenges Explorations Initiative  Funding Source: researchfish,137
1056,gates,NATIONAL INSTITUTE OF BIOMEDICAL IMAGING AND BIOENGINEERINGUnited States Department of Health & Human ServicesNational Institutes of Health (NIH) - USANIH National Institute of Biomedical Imaging & Bioengineering (NIBIB)  Funding Source: NIH RePORTER,136
1057,gates,Irish AidCGIAR,134
1058,gates,Bill and Melinda Gates foundationBill & Melinda Gates Foundation,134
1059,gates,National Institute of Allergy and Infectious Diseases (NIAID)United States Department of Health & Human ServicesNational Institutes of Health (NIH) - USANIH National Institute of Allergy & Infectious Diseases (NIAID),132
1060,gates,"Bill & Melinda Gates Foundation, Seattle, WABill & Melinda Gates Foundation",131
1061,gates,EUNICE KENNEDY SHRIVER NATIONAL INSTITUTE OF CHILD HEALTH &HUMAN DEVELOPMENTUnited States Department of Health & Human ServicesNational Institutes of Health (NIH) - USANIH Eunice Kennedy Shriver National Institute of Child Health & Human Development (NICHD)  Funding Source: NIH RePORTER,127
1062,gates,Wellcome Trust of Great BritainWellcome Trust,122
1063,gates,NATIONAL INSTITUTE ON AGINGUnited States Department of Health & Human ServicesNational Institutes of Health (NIH) - USANIH National Institute on Aging (NIA)  Funding Source: NIH RePORTER,120
1064,gates,US Agency for International DevelopmentUnited States Agency for International Development (USAID),119
1065,gates,MRCUK Research & Innovation (UKRI)Medical Research Council UK (MRC),117
1066,gates,NATIONAL INSTITUTE ON DRUG ABUSEUnited States Department of Health & Human ServicesNational Institutes of Health (NIH) - USANIH National Institute on Drug Abuse (NIDA)European Commission  Funding Source: NIH RePORTER,117
1067,gates,BMGF,113
1068,gates,Department for International Development,113
1069,gates,NATIONAL INSTITUTE OF ENVIRONMENTAL HEALTH SCIENCESUnited States Department of Health & Human ServicesNational Institutes of Health (NIH) - USANIH National Institute of Environmental Health Sciences (NIEHS)  Funding Source: NIH RePORTER,113
1070,gates,Grand Challenges CanadaCGIAR,113
1071,gates,PfizerPfizer,111
1072,gates,GlaxoSmithKlineGlaxoSmithKline,108
1073,gates,"Grants-in-Aid for Scientific ResearchMinistry of Education, Culture, Sports, Science and Technology, Japan (MEXT)Japan Society for the Promotion of ScienceGrants-in-Aid for Scientific Research (KAKENHI)  Funding Source: KAKEN",108
1074,gates,Ministry of Foreign Affairs of the Netherlands,107
1075,gates,National Institute of Mental HealthUnited States Department of Health & Human ServicesNational Institutes of Health (NIH) - USANIH National Institute of Mental Health (NIMH),106
1076,gates,NATIONAL HUMAN GENOME RESEARCH INSTITUTEUnited States Department of Health & Human ServicesNational Institutes of Health (NIH) - USANIH National Human Genome Research Institute (NHGRI)  Funding Source: NIH RePORTER,100
1077,gates,Australian Research CouncilAustralian Research Council,99
1078,gates,NATIONAL INSTITUTE OF NEUROLOGICAL DISORDERS AND STROKEUnited States Department of Health & Human ServicesNational Institutes of Health (NIH) - USANIH National Institute of Neurological Disorders & Stroke (NINDS)  Funding Source: NIH RePORTER,99
1079,gates,UNICEF,95
1080,gates,MerckMerck & Company,95
1081,gates,Royal SocietyRoyal Society of LondonEuropean Commission,94
1082,gates,Centers for Disease Control and PreventionUnited States Department of Health & Human ServicesCenters for Disease Control & Prevention - USA,93
1083,gates,Government of CanadaCGIAR,92
1084,gates,BBSRCUK Research & Innovation (UKRI)Biotechnology and Biological Sciences Research Council (BBSRC),92
1085,gates,Fogarty International CenterUnited States Department of Health & Human ServicesNational Institutes of Health (NIH) - USANIH Fogarty International Center (FIC),92
1086,gates,Foundation for the National Institutes of HealthUnited States Department of Health & Human ServicesNational Institutes of Health (NIH) - USA,92
1087,gates,Government of Norway,91
1088,gates,National Health and Medical Research Council of AustraliaNational Health and Medical Research Council of AustraliaUK Research & Innovation (UKRI)Medical Research Council UK (MRC),91
1089,gates,National Institute of General Medical SciencesUnited States Department of Health & Human ServicesNational Institutes of Health (NIH) - USANIH National Institute of General Medical Sciences (NIGMS),90
1090,gates,Gilead SciencesGilead Sciences,89
1091,gates,Engineering and Physical Sciences Research CouncilUK Research & Innovation (UKRI)Engineering & Physical Sciences Research Council (EPSRC)  Funding Source: researchfish,87
1092,gates,EUEuropean Commission,84
1093,gates,United Kingdom Department for International Development (DFID),82
1094,gates,Ministry of Finance of Japan,81
1095,gates,National Institute of HealthUnited States Department of Health & Human ServicesNational Institutes of Health (NIH) - USA,78
1096,gates,Ministry of Foreign Affairs of Denmark,77
1097,gates,Burroughs Wellcome FundBurroughs Wellcome Fund,76
1098,gates,Government of Sweden,75
1099,gates,William and Flora Hewlett Foundation,75
1100,gates,Biotechnology and Biological Sciences Research CouncilUK Research & Innovation (UKRI)Biotechnology and Biological Sciences Research Council (BBSRC),75
1101,gates,"Bill and Melinda Gates Foundation, Seattle, WABill & Melinda Gates Foundation",75
1102,gates,National Cancer InstituteUnited States Department of Health & Human ServicesNational Institutes of Health (NIH) - USANIH National Cancer Institute (NCI),74
1103,gates,Medicines for Malaria Venture,73
1104,gates,National Research Foundation of South AfricaNational Research Foundation - South Africa,73
1105,gates,Swedish Research CouncilSwedish Research CouncilEuropean Commission,72
1106,gates,Syngenta Foundation for Sustainable Agriculture (SFSA),72
1107,gates,PATH,72
1108,gates,United Kingdom Department for International Development,71
1109,gates,Australian National Health and Medical Research CouncilNational Health and Medical Research Council of Australia,70
1110,gates,Doris Duke Charitable FoundationDoris Duke Charitable Foundation (DDCF),70
1111,gates,Thrasher Research Fund,69
1112,gates,NovartisNovartis,69
1113,gates,Swedish International Development Cooperation Agency (Sida),67
1114,gates,CNPqConselho Nacional de Desenvolvimento Cientifico e Tecnologico (CNPQ),67
1115,gates,"Bill & Melinda Gates Foundation, USABill & Melinda Gates Foundation",66
1116,gates,U.S. National Institutes of HealthUnited States Department of Health & Human ServicesNational Institutes of Health (NIH) - USA,65
1117,gates,Clinton Health Access Initiative,65
1118,gates,Norwegian Agency for Development Cooperation (NORAD)CGIAR,64
1119,gates,Ford Foundation,64
1120,gates,CDCUnited States Department of Health & Human ServicesCenters for Disease Control & Prevention - USA,63
1121,gates,Swedish International Development Cooperation Agency,63
1122,gates,National Institute of Allergy and Infectious Diseases of the National Institutes of HealthUnited States Department of Health & Human ServicesNational Institutes of Health (NIH) - USANIH National Institute of Allergy & Infectious Diseases (NIAID),62
1123,gates,Swiss National Science FoundationSwiss National Science Foundation (SNSF)European Commission,62
1124,gates,International AIDS Vaccine Initiative,61
1125,gates,International AIDS Vaccine Initiative (IAVI),61
1126,gates,NHMRCNational Health and Medical Research Council of Australia,61
1127,gates,NICHDUnited States Department of Health & Human ServicesNational Institutes of Health (NIH) - USANIH Eunice Kennedy Shriver National Institute of Child Health & Human Development (NICHD),61
1128,gates,National Key Research and Development Program of China,60
1129,gates,Task Force for Global Health,60
1130,gates,"Wellcome Trust, UKWellcome Trust",59
1131,gates,DFID,59
1132,gates,NATIONAL EYE INSTITUTEUnited States Department of Health & Human ServicesNational Institutes of Health (NIH) - USANIH National Eye Institute (NEI)  Funding Source: NIH RePORTER,59
1133,gates,Johns Hopkins UniversityJohns Hopkins University,59
1134,gates,NATIONAL INSTITUTE OF ARTHRITIS AND MUSCULOSKELETAL AND SKIN DISEASESUnited States Department of Health & Human ServicesNational Institutes of Health (NIH) - USANIH National Institute of Arthritis & Musculoskeletal & Skin Diseases (NIAMS)  Funding Source: NIH RePORTER,59
1135,gates,South African Research Chairs Initiative of the Department of Science and Technology,58
1136,gates,International Initiative for Impact Evaluation (3ie),58
1137,gates,NATIONAL LIBRARY OF MEDICINEUnited States Department of Health & Human ServicesNational Institutes of Health (NIH) - USANIH National Library of Medicine (NLM)  Funding Source: NIH RePORTER,58
1138,gates,"National Institutes of Health, Fogarty International CenterUnited States Department of Health & Human ServicesNational Institutes of Health (NIH) - USANIH Fogarty International Center (FIC)",58
1139,gates,Bloomberg Philanthropies,56
1140,gates,Wellcome,55
1141,gates,Canadian Institutes of Health Research (CIHR)Canadian Institutes of Health Research (CIHR),55
1142,gates,US National Institutes of Health (NIH)United States Department of Health & Human ServicesNational Institutes of Health (NIH) - USA,54
1143,gates,UNITAID,54
1144,gates,National Research Foundation,53
1145,gates,National Institute of Child Health and Human DevelopmentUnited States Department of Health & Human ServicesNational Institutes of Health (NIH) - USANIH Eunice Kennedy Shriver National Institute of Child Health & Human Development (NICHD),53
1146,gates,Carnegie Corporation of New York,53
1147,gates,Wellcome Trust (UK)Wellcome Trust,53
1148,gates,Department of DefenseUnited States Department of Defense,52
1149,gates,U.S. Agency for International DevelopmentUnited States Agency for International Development (USAID),52
1150,gates,IAVI,51
1151,gates,Economic and Social Research CouncilUK Research & Innovation (UKRI)Economic & Social Research Council (ESRC)  Funding Source: researchfish,51
1152,gates,National Institute on AgingUnited States Department of Health & Human ServicesNational Institutes of Health (NIH) - USANIH National Institute on Aging (NIA),50
1153,gates,UK Government,50
1154,gates,European CommunityEuropean Commission,50
1155,gates,"Ministry of Science and Technology of ChinaMinistry of Science and Technology, China",50
1156,gates,"RAPIDD program of the Science & Technology Directorate, Department of Homeland SecurityUnited States Department of Homeland Security (DHS)",49
